<?xml version="1.0" encoding="UTF-8"?>
<npc_skill_templates xmlns:xsi="http://www.w3.org/2001/XMLSchema-instance" xsi:noNamespaceSchemaLocation="../../npc_skills.xsd">
	<!-- Draconute Scout -->
	<npcskills npcid="236005">
		<npcskill skillid="21135" skilllevel="1" probability="100" useinspawned="true"/>
		<npcskill skillid="19430" skilllevel="56" probability="75"/>
		<npcskill skillid="17243" skilllevel="1" probability="33"/>
	</npcskills>
	<!-- Draconute Combatant -->
	<npcskills npcid="236006">
		<npcskill skillid="21135" skilllevel="1" probability="100" useinspawned="true"/>
		<npcskill skillid="16516" skilllevel="1" probability="75"/>
	</npcskills>
	<!-- Drill Camp Assasin -->
	<npcskills npcid="236007">
		<npcskill skillid="21135" skilllevel="1" probability="100" useinspawned="true"/>
		<npcskill skillid="17322" skilllevel="1" probability="50"/>
	</npcskills>
	<!-- Drill Camp Guard | Classified Drill Camp Instructor -->
	<npcskills npcid="236008 236084">
		<npcskill skillid="21135" skilllevel="1" probability="100" useinspawned="true"/>
		<npcskill skillid="17294" skilllevel="1" probability="80"/>
	</npcskills>
	<!-- Trained Vespine -->
	<npcskills npcid="236009">
		<npcskill skillid="20945" skilllevel="1" probability="25"/>
	</npcskills>
	<!-- Trained Porgus | Trained Worg | Crumbling Skelesword | Trained Fierce Lapilima | Trained Drakie -->
	<npcskills npcid="236010 236011 236012 236018 236021 236097">
		<npcskill skillid="21300" skilllevel="1" probability="40"/>
	</npcskills>
	<!-- Withering Husk -->
	<npcskills npcid="236013">
		<npcskill skillid="16825" skilllevel="1" probability="33"/>
	</npcskills>
	<!-- Ragelich Adept -->
	<npcskills npcid="236014">
		<npcskill skillid="19052" skilllevel="1" probability="14"/>
		<npcskill skillid="20944" skilllevel="36" probability="45"/>
		<npcskill skillid="16830" skilllevel="1" probability="100" maxhp="10"/>
	</npcskills>
	<!-- Trained Clodworm -->
	<npcskills npcid="236020 236096 236098">
		<npcskill skillid="17558" skilllevel="1" probability="67"/>
	</npcskills>
	<!-- Drill Instructor Diplito -->
	<npcskills npcid="236303">
		<npcskill skillid="21287" skilllevel="1" probability="100" maxhp="50" cooldown="30000"/>
		<npcskill skillid="17335" skilllevel="1" probability="75"/>
	</npcskills>
	<!-- Drill Instructor Pratica -->
	<npcskills npcid="236304">
		<npcskill skillid="16405" skilllevel="1" probability="100" cooldown="20000"/>
		<npcskill skillid="21285" skilllevel="1" probability="40"/>
		<npcskill skillid="22658" skilllevel="20" probability="33"/>
	</npcskills>
	<!-- Drill Instructor Exico -->
	<npcskills npcid="236305">
		<npcskill skillid="17048" skilllevel="1" probability="50"/>
		<!-- <npcskill skillid="21432" skilllevel="1" probability="100" maxhp="48" cooldown="60000"/> -->
	</npcskills>
	<!-- Reviver Nasto -->
	<npcskills npcid="236306">
		<npcskill skillid="16570" skilllevel="1" probability="66" cooldown="12000"/>
		<npcskill skillid="22106" skilllevel="1" probability="100" maxhp="66" cooldown="300000"/>
		<npcskill skillid="22106" skilllevel="1" probability="100" maxhp="33" cooldown="300000"/>
	</npcskills>
	<!-- Improved Thermitron -->
	<npcskills npcid="855852">
		<npcskill skillid="21534" skilllevel="1" probability="100"/>
	</npcskills>
	<!-- Skeleton Guard -->
	<npcskills npcid="855908">
		<npcskill skillid="16556" skilllevel="1" probability="25"/>
	</npcskills>
</npc_skill_templates>